{
  "schema_version": "0.1.0",
  "trajectory_id": "synthetic-trajectory-001",
  "match_id": "synthetic-match-001",
  "rack_id": "synthetic-rack-001",
  "shot_id": "synthetic-shot-001",
  "table_id": "vision-table-001",
  "state_version": 1,
  "source": "synthetic-demo",
  "timebase": {
    "timestamp_unit": "ns",
    "timestamp_origin": "shot_start",
    "nominal_fps": 200
  },
  "coordinate_frame": {
    "units": "mm",
    "origin": "table_center",
    "x_axis": "table_width",
    "y_axis": "table_length",
    "positive_x": "inherited_from_vision",
    "positive_y": "inherited_from_vision",
    "orientation_status": "provisional"
  },
  "table_geometry": {
    "active_length_mm": 2540,
    "active_width_mm": 1270
  },
  "frames": [
    {
      "frame_index": 0,
      "timestamp_ns": 0,
      "balls": [
        {
          "id": 0,
          "x_mm": -104.727158,
          "y_mm": -515.194031
        },
        {
          "id": 1,
          "x_mm": 608.425,
          "y_mm": 937.533936
        },
        {
          "id": 2,
          "x_mm": 608.425,
          "y_mm": 505.473724
        },
        {
          "id": 3,
          "x_mm": 169.014557,
          "y_mm": 323.203735
        },
        {
          "id": 4,
          "x_mm": -608.425,
          "y_mm": -334.572113
        },
        {
          "id": 5,
          "x_mm": 608.425,
          "y_mm": -582.131958
        },
        {
          "id": 6,
          "x_mm": 577.600037,
          "y_mm": -106.506905
        },
        {
          "id": 7,
          "x_mm": 607.12561,
          "y_mm": -221.173203
        },
        {
          "id": 8,
          "x_mm": 608.425,
          "y_mm": -840.97229
        },
        {
          "id": 9,
          "x_mm": -608.425,
          "y_mm": -834.427795
        },
        {
          "id": 10,
          "x_mm": -221.847733,
          "y_mm": -882.89032
        },
        {
          "id": 11,
          "x_mm": -133.220627,
          "y_mm": -1243.425
        },
        {
          "id": 12,
          "x_mm": 272.242188,
          "y_mm": -408.723358
        },
        {
          "id": 13,
          "x_mm": 138.255905,
          "y_mm": -605.556396
        },
        {
          "id": 14,
          "x_mm": -68.355934,
          "y_mm": -172.964355
        },
        {
          "id": 15,
          "x_mm": -608.425,
          "y_mm": 804.388428
        }
      ]
    },
    {
      "frame_index": 1,
      "timestamp_ns": 5000000,
      "balls": [
        {
          "id": 0,
          "x_mm": -96.727158,
          "y_mm": -505.194031
        },
        {
          "id": 1,
          "x_mm": 608.425,
          "y_mm": 937.533936
        },
        {
          "id": 2,
          "x_mm": 608.425,
          "y_mm": 505.473724
        },
        {
          "id": 3,
          "x_mm": 164.014557,
          "y_mm": 329.203735
        },
        {
          "id": 4,
          "x_mm": -608.425,
          "y_mm": -334.572113
        },
        {
          "id": 5,
          "x_mm": 608.425,
          "y_mm": -582.131958
        },
        {
          "id": 6,
          "x_mm": 577.600037,
          "y_mm": -106.506905
        },
        {
          "id": 7,
          "x_mm": 607.12561,
          "y_mm": -221.173203
        },
        {
          "id": 8,
          "x_mm": 608.425,
          "y_mm": -840.97229
        },
        {
          "id": 9,
          "x_mm": -608.425,
          "y_mm": -834.427795
        },
        {
          "id": 10,
          "x_mm": -221.847733,
          "y_mm": -882.89032
        },
        {
          "id": 11,
          "x_mm": -133.220627,
          "y_mm": -1243.425
        },
        {
          "id": 12,
          "x_mm": 272.242188,
          "y_mm": -408.723358
        },
        {
          "id": 13,
          "x_mm": 138.255905,
          "y_mm": -605.556396
        },
        {
          "id": 14,
          "x_mm": -68.355934,
          "y_mm": -172.964355
        },
        {
          "id": 15,
          "x_mm": -608.425,
          "y_mm": 804.388428
        }
      ]
    },
    {
      "frame_index": 2,
      "timestamp_ns": 10000000,
      "balls": [
        {
          "id": 0,
          "x_mm": -88.727158,
          "y_mm": -495.194031
        },
        {
          "id": 1,
          "x_mm": 608.425,
          "y_mm": 937.533936
        },
        {
          "id": 2,
          "x_mm": 608.425,
          "y_mm": 505.473724
        },
        {
          "id": 3,
          "x_mm": 159.014557,
          "y_mm": 335.203735
        },
        {
          "id": 4,
          "x_mm": -608.425,
          "y_mm": -334.572113
        },
        {
          "id": 5,
          "x_mm": 608.425,
          "y_mm": -582.131958
        },
        {
          "id": 6,
          "x_mm": 577.600037,
          "y_mm": -106.506905
        },
        {
          "id": 7,
          "x_mm": 607.12561,
          "y_mm": -221.173203
        },
        {
          "id": 8,
          "x_mm": 608.425,
          "y_mm": -840.97229
        },
        {
          "id": 9,
          "x_mm": -608.425,
          "y_mm": -834.427795
        },
        {
          "id": 10,
          "x_mm": -221.847733,
          "y_mm": -882.89032
        },
        {
          "id": 11,
          "x_mm": -133.220627,
          "y_mm": -1243.425
        },
        {
          "id": 12,
          "x_mm": 272.242188,
          "y_mm": -408.723358
        },
        {
          "id": 13,
          "x_mm": 138.255905,
          "y_mm": -605.556396
        },
        {
          "id": 14,
          "x_mm": -68.355934,
          "y_mm": -172.964355
        },
        {
          "id": 15,
          "x_mm": -608.425,
          "y_mm": 804.388428
        }
      ]
    },
    {
      "frame_index": 4,
      "timestamp_ns": 20000000,
      "balls": [
        {
          "id": 0,
          "x_mm": -72.727158,
          "y_mm": -475.194031
        },
        {
          "id": 1,
          "x_mm": 608.425,
          "y_mm": 937.533936
        },
        {
          "id": 2,
          "x_mm": 608.425,
          "y_mm": 505.473724
        },
        {
          "id": 3,
          "x_mm": 149.014557,
          "y_mm": 347.203735
        },
        {
          "id": 4,
          "x_mm": -608.425,
          "y_mm": -334.572113
        },
        {
          "id": 5,
          "x_mm": 608.425,
          "y_mm": -582.131958
        },
        {
          "id": 6,
          "x_mm": 577.600037,
          "y_mm": -106.506905
        },
        {
          "id": 7,
          "x_mm": 607.12561,
          "y_mm": -221.173203
        },
        {
          "id": 8,
          "x_mm": 608.425,
          "y_mm": -840.97229
        },
        {
          "id": 9,
          "x_mm": -608.425,
          "y_mm": -834.427795
        },
        {
          "id": 10,
          "x_mm": -221.847733,
          "y_mm": -882.89032
        },
        {
          "id": 11,
          "x_mm": -133.220627,
          "y_mm": -1243.425
        },
        {
          "id": 12,
          "x_mm": 272.242188,
          "y_mm": -408.723358
        },
        {
          "id": 13,
          "x_mm": 138.255905,
          "y_mm": -605.556396
        },
        {
          "id": 14,
          "x_mm": -68.355934,
          "y_mm": -172.964355
        },
        {
          "id": 15,
          "x_mm": -608.425,
          "y_mm": 804.388428
        }
      ]
    },
    {
      "frame_index": 5,
      "timestamp_ns": 25000000,
      "balls": [
        {
          "id": 0,
          "x_mm": -64.727158,
          "y_mm": -465.194031
        },
        {
          "id": 1,
          "x_mm": 608.425,
          "y_mm": 937.533936
        },
        {
          "id": 2,
          "x_mm": 608.425,
          "y_mm": 505.473724
        },
        {
          "id": 3,
          "x_mm": 144.014557,
          "y_mm": 353.203735
        },
        {
          "id": 4,
          "x_mm": -608.425,
          "y_mm": -334.572113
        },
        {
          "id": 5,
          "x_mm": 608.425,
          "y_mm": -582.131958
        },
        {
          "id": 6,
          "x_mm": 577.600037,
          "y_mm": -106.506905
        },
        {
          "id": 7,
          "x_mm": 607.12561,
          "y_mm": -221.173203
        },
        {
          "id": 8,
          "x_mm": 608.425,
          "y_mm": -840.97229
        },
        {
          "id": 9,
          "x_mm": -608.425,
          "y_mm": -834.427795
        },
        {
          "id": 10,
          "x_mm": -221.847733,
          "y_mm": -882.89032
        },
        {
          "id": 11,
          "x_mm": -133.220627,
          "y_mm": -1243.425
        },
        {
          "id": 12,
          "x_mm": 272.242188,
          "y_mm": -408.723358
        },
        {
          "id": 13,
          "x_mm": 138.255905,
          "y_mm": -605.556396
        },
        {
          "id": 14,
          "x_mm": -68.355934,
          "y_mm": -172.964355
        },
        {
          "id": 15,
          "x_mm": -608.425,
          "y_mm": 804.388428
        }
      ]
    },
    {
      "frame_index": 7,
      "timestamp_ns": 35000000,
      "balls": [
        {
          "id": 0,
          "x_mm": -48.727158,
          "y_mm": -445.194031
        },
        {
          "id": 1,
          "x_mm": 608.425,
          "y_mm": 937.533936
        },
        {
          "id": 2,
          "x_mm": 608.425,
          "y_mm": 505.473724
        },
        {
          "id": 3,
          "x_mm": 134.014557,
          "y_mm": 365.203735
        },
        {
          "id": 4,
          "x_mm": -608.425,
          "y_mm": -334.572113
        },
        {
          "id": 5,
          "x_mm": 608.425,
          "y_mm": -582.131958
        },
        {
          "id": 6,
          "x_mm": 577.600037,
          "y_mm": -106.506905
        },
        {
          "id": 7,
          "x_mm": 607.12561,
          "y_mm": -221.173203
        },
        {
          "id": 8,